{
  "spec": {
    "name": "sitepack",
    "version": "1.0.0"
  },
  "package": {
    "id": "objects-two-objects"
  },
  "createdAt": "2025-01-01T00:00:00Z",
  "profiles": [
    "full"
  ],
  "artifacts": [
    "recordset.example_table",
    "objects.index",
    "objects.passport.example.news",
    "objects.passport.example.catalog"
  ]
}
