{
  "spec": {
    "name": "sitepack",
    "version": "1.0.0"
  },
  "package": {
    "id": "full-code"
  },
  "createdAt": "2025-01-01T00:00:00Z",
  "profiles": [
    "full-code"
  ],
  "artifacts": [
    "entities.content",
    "assets.index",
    "config.kv",
    "recordset.example_table",
    "code.readme",
    "code.software_manifest"
  ]
}
